{
  "applied_offsets": {
    "0": 1,
    "1": 2,
    "2": 0
  },
  "canal_position_recovery": null,
  "cleanup_actions": [
    {
      "finished_at": "2026-07-29T19:53:45Z",
      "name": "dispatch-owned-m6-real-fault",
      "success": true
    }
  ],
  "cleanup_failures": 0,
  "consistency_preconditions": [
    {
      "name": "dedicated-compose-project",
      "observed_at": "2026-07-29T19:52:54Z",
      "satisfied": true
    },
    {
      "name": "pinned-stack-ready",
      "observed_at": "2026-07-29T19:52:54Z",
      "satisfied": true
    },
    {
      "name": "baseline-lag-zero",
      "observed_at": "2026-07-29T19:52:54Z",
      "satisfied": true
    }
  ],
  "dependency_versions": {
    "canal": "1.1.8",
    "elasticsearch": "8.17.0",
    "kafka": "4.1.2",
    "mysql": "8.4.8",
    "project_head": "fb1a87733f0dcea5f41d1a0adbd1da2c980cac97"
  },
  "exact_diff_count": 0,
  "expected_intermediate_states": [
    "CATCHING_UP"
  ],
  "expected_pipeline_state": "HEALTHY",
  "failed_assertions": [],
  "finished_at": "2026-07-29T19:53:55Z",
  "observed_intermediate_states": [
    "CATCHING_UP"
  ],
  "observed_pipeline_state": "HEALTHY",
  "product_unresolved_dlq_count": 0,
  "rebuild_required_before_rebuild": false,
  "record_unresolved_dlq_count": 0,
  "recovery_action": "restart the consumer and converge from the uncommitted offset",
  "recovery_action_observed": true,
  "requires_rebuild": false,
  "result": "PASS",
  "runner_run_id": "b64ad2b2-bcc4-411b-bc38-7d15f072ef4a",
  "scenario_id": "consumer-crash-before-elasticsearch",
  "scenario_lag_satisfied": true,
  "schema_version": 1,
  "source_watermark": 2,
  "started_at": "2026-07-29T19:52:02Z",
  "target_watermark_passed": true,
  "target_watermarks": {
    "elasticsearch_revision": 2,
    "mysql_revision": 2,
    "passed": true
  },
  "tombstone_mismatch_count": 0,
  "unresolved_dlq_count": 0,
  "verification": {
    "conclusive": true,
    "exact_managed_field_diff_count": 0,
    "observed_at": "2026-07-29T19:53:49Z",
    "run_id": "35eb6fa5-1ddc-4694-8811-36df6741b114",
    "stable": true,
    "status": "PASS",
    "version_metadata_diff_count": 0
  },
  "watermark_run_id": "35eb6fa5-1ddc-4694-8811-36df6741b114"
}
