{
  "applied_offsets": {
    "0": 1,
    "1": 2,
    "2": 0
  },
  "canal_position_recovery": null,
  "cleanup_actions": [
    {
      "finished_at": "2026-07-30T03:54:05Z",
      "name": "dispatch-owned-m6-real-fault",
      "success": true
    }
  ],
  "cleanup_failures": 0,
  "consistency_preconditions": [
    {
      "name": "dedicated-compose-project",
      "observed_at": "2026-07-30T03:53:40Z",
      "satisfied": true
    },
    {
      "name": "pinned-stack-ready",
      "observed_at": "2026-07-30T03:53:40Z",
      "satisfied": true
    },
    {
      "name": "baseline-lag-zero",
      "observed_at": "2026-07-30T03:53:40Z",
      "satisfied": true
    }
  ],
  "dependency_versions": {
    "canal": "1.1.8",
    "elasticsearch": "8.17.0",
    "kafka": "4.1.2",
    "mysql": "8.4.8",
    "project_head": "bb75ab0c19b3f64090faec9d281d56ff43087a55"
  },
  "exact_diff_count": 0,
  "expected_intermediate_states": [
    "HEALTHY"
  ],
  "expected_pipeline_state": "HEALTHY",
  "failed_assertions": [],
  "finished_at": "2026-07-30T03:54:17Z",
  "observed_intermediate_states": [
    "HEALTHY"
  ],
  "observed_pipeline_state": "HEALTHY",
  "product_unresolved_dlq_count": 0,
  "rebuild_required_before_rebuild": false,
  "record_unresolved_dlq_count": 0,
  "recovery_action": "settle through the per-product external-version fence",
  "recovery_action_observed": true,
  "requires_rebuild": false,
  "result": "PASS",
  "runner_run_id": "69c99ec4-b06c-4c69-9288-3ec0f1ed8cd9",
  "scenario_id": "duplicate-event",
  "scenario_lag_satisfied": true,
  "schema_version": 1,
  "source_watermark": 1,
  "started_at": "2026-07-30T03:52:27Z",
  "target_watermark_passed": true,
  "target_watermarks": {
    "elasticsearch_revision": 1,
    "mysql_revision": 1,
    "passed": true
  },
  "tombstone_mismatch_count": 0,
  "unresolved_dlq_count": 0,
  "verification": {
    "conclusive": true,
    "exact_managed_field_diff_count": 0,
    "observed_at": "2026-07-30T03:54:09Z",
    "run_id": "27f8a74f-6d3f-4f5e-a0a0-e1db6524f5de",
    "stable": true,
    "status": "PASS",
    "version_metadata_diff_count": 0
  },
  "watermark_run_id": "27f8a74f-6d3f-4f5e-a0a0-e1db6524f5de"
}
