{
  "applied_offsets": {
    "0": 1,
    "1": 0,
    "2": 2
  },
  "canal_position_recovery": null,
  "cleanup_actions": [
    {
      "finished_at": "2026-07-30T03:37:17Z",
      "name": "dispatch-owned-m6-real-fault",
      "success": true
    }
  ],
  "cleanup_failures": 0,
  "consistency_preconditions": [
    {
      "name": "dedicated-compose-project",
      "observed_at": "2026-07-30T03:36:57Z",
      "satisfied": true
    },
    {
      "name": "pinned-stack-ready",
      "observed_at": "2026-07-30T03:36:57Z",
      "satisfied": true
    },
    {
      "name": "baseline-lag-zero",
      "observed_at": "2026-07-30T03:36:57Z",
      "satisfied": true
    }
  ],
  "dependency_versions": {
    "canal": "1.1.8",
    "elasticsearch": "8.17.0",
    "kafka": "4.1.2",
    "mysql": "8.4.8",
    "project_head": "bb75ab0c19b3f64090faec9d281d56ff43087a55"
  },
  "exact_diff_count": 0,
  "expected_intermediate_states": [
    "CATCHING_UP"
  ],
  "expected_pipeline_state": "HEALTHY",
  "failed_assertions": [],
  "finished_at": "2026-07-30T03:37:38Z",
  "observed_intermediate_states": [
    "CATCHING_UP"
  ],
  "observed_pipeline_state": "HEALTHY",
  "product_unresolved_dlq_count": 0,
  "rebuild_required_before_rebuild": false,
  "record_unresolved_dlq_count": 0,
  "recovery_action": "remove the Kafka toxic and prove automatic convergence",
  "recovery_action_observed": true,
  "requires_rebuild": false,
  "result": "PASS",
  "runner_run_id": "c193d60a-9dc7-40da-b588-9935741e6930",
  "scenario_id": "kafka-temporary-unavailable",
  "scenario_lag_satisfied": true,
  "schema_version": 1,
  "source_watermark": 2,
  "started_at": "2026-07-30T03:34:37Z",
  "target_watermark_passed": true,
  "target_watermarks": {
    "elasticsearch_revision": 2,
    "mysql_revision": 2,
    "passed": true
  },
  "tombstone_mismatch_count": 0,
  "unresolved_dlq_count": 0,
  "verification": {
    "conclusive": true,
    "exact_managed_field_diff_count": 0,
    "observed_at": "2026-07-30T03:37:24Z",
    "run_id": "b9ea8d21-220e-4eca-8842-5939d4c76b27",
    "stable": true,
    "status": "PASS",
    "version_metadata_diff_count": 0
  },
  "watermark_run_id": "b9ea8d21-220e-4eca-8842-5939d4c76b27"
}
