{
  "applied_offsets": {
    "0": 9,
    "1": 8,
    "2": 8
  },
  "canal_position_recovery": null,
  "cleanup_actions": [
    {
      "finished_at": "2026-07-30T04:11:20Z",
      "name": "dispatch-owned-m6-real-fault",
      "success": true
    }
  ],
  "cleanup_failures": 0,
  "consistency_preconditions": [
    {
      "name": "dedicated-compose-project",
      "observed_at": "2026-07-30T04:09:49Z",
      "satisfied": true
    },
    {
      "name": "pinned-stack-ready",
      "observed_at": "2026-07-30T04:09:49Z",
      "satisfied": true
    },
    {
      "name": "baseline-lag-zero",
      "observed_at": "2026-07-30T04:09:49Z",
      "satisfied": true
    }
  ],
  "dependency_versions": {
    "canal": "1.1.8",
    "elasticsearch": "8.17.0",
    "kafka": "4.1.2",
    "mysql": "8.4.8",
    "project_head": "bb75ab0c19b3f64090faec9d281d56ff43087a55"
  },
  "exact_diff_count": 0,
  "expected_intermediate_states": [
    "REBUILDING",
    "DEGRADED"
  ],
  "expected_pipeline_state": "HEALTHY",
  "failed_assertions": [],
  "finished_at": "2026-07-30T04:11:41Z",
  "observed_intermediate_states": [
    "DEGRADED",
    "REBUILDING"
  ],
  "observed_pipeline_state": "HEALTHY",
  "product_unresolved_dlq_count": 0,
  "rebuild_required_before_rebuild": true,
  "record_unresolved_dlq_count": 0,
  "recovery_action": "recover persisted pre-cutover state and rerun the rebuild without the failpoint",
  "recovery_action_observed": true,
  "requires_rebuild": true,
  "result": "PASS",
  "runner_run_id": "5feaed30-9f49-47d0-8e50-1a23308f3675",
  "scenario_id": "rebuild-crash-and-restart",
  "scenario_lag_satisfied": true,
  "schema_version": 1,
  "source_watermark": 1,
  "started_at": "2026-07-30T04:08:25Z",
  "target_watermark_passed": true,
  "target_watermarks": {
    "elasticsearch_revision": 1,
    "mysql_revision": 1,
    "passed": true
  },
  "tombstone_mismatch_count": 0,
  "unresolved_dlq_count": 0,
  "verification": {
    "conclusive": true,
    "exact_managed_field_diff_count": 0,
    "observed_at": "2026-07-30T04:11:27Z",
    "run_id": "024439f2-3777-45d5-b8f0-16160b5810e6",
    "stable": true,
    "status": "PASS",
    "version_metadata_diff_count": 0
  },
  "watermark_run_id": "024439f2-3777-45d5-b8f0-16160b5810e6"
}
