{
  "applied_offsets": {
    "0": 3,
    "1": 0,
    "2": 0
  },
  "canal_position_recovery": null,
  "cleanup_actions": [
    {
      "finished_at": "2026-07-29T20:11:09Z",
      "name": "dispatch-owned-m6-real-fault",
      "success": true
    }
  ],
  "cleanup_failures": 0,
  "consistency_preconditions": [
    {
      "name": "dedicated-compose-project",
      "observed_at": "2026-07-29T20:11:04Z",
      "satisfied": true
    },
    {
      "name": "pinned-stack-ready",
      "observed_at": "2026-07-29T20:11:04Z",
      "satisfied": true
    },
    {
      "name": "baseline-lag-zero",
      "observed_at": "2026-07-29T20:11:04Z",
      "satisfied": true
    }
  ],
  "dependency_versions": {
    "canal": "1.1.8",
    "elasticsearch": "8.17.0",
    "kafka": "4.1.2",
    "mysql": "8.4.8",
    "project_head": "fb1a87733f0dcea5f41d1a0adbd1da2c980cac97"
  },
  "exact_diff_count": 0,
  "expected_intermediate_states": [
    "DEGRADED"
  ],
  "expected_pipeline_state": "HEALTHY",
  "failed_assertions": [],
  "finished_at": "2026-07-29T20:11:19Z",
  "observed_intermediate_states": [
    "DEGRADED"
  ],
  "observed_pipeline_state": "HEALTHY",
  "product_unresolved_dlq_count": 0,
  "rebuild_required_before_rebuild": false,
  "record_unresolved_dlq_count": 0,
  "recovery_action": "use independent M4 detection and controlled equal-revision repair after fixing the projector",
  "recovery_action_observed": true,
  "requires_rebuild": false,
  "result": "PASS",
  "runner_run_id": "6b004145-70c4-437f-98d9-2c4ed855816a",
  "scenario_id": "consumer-systematic-mapping-bug",
  "scenario_lag_satisfied": true,
  "schema_version": 1,
  "source_watermark": 2,
  "started_at": "2026-07-29T20:10:11Z",
  "target_watermark_passed": true,
  "target_watermarks": {
    "elasticsearch_revision": 2,
    "mysql_revision": 2,
    "passed": true
  },
  "tombstone_mismatch_count": 0,
  "unresolved_dlq_count": 0,
  "verification": {
    "conclusive": true,
    "exact_managed_field_diff_count": 0,
    "observed_at": "2026-07-29T20:11:13Z",
    "run_id": "003c5200-dec0-46f2-b54c-cbd90a465630",
    "stable": true,
    "status": "PASS",
    "version_metadata_diff_count": 0
  },
  "watermark_run_id": "003c5200-dec0-46f2-b54c-cbd90a465630"
}
