{
  "applied_offsets": {
    "0": 3,
    "1": 1,
    "2": 1
  },
  "canal_position_recovery": null,
  "cleanup_actions": [
    {
      "finished_at": "2026-07-29T20:02:23Z",
      "name": "dispatch-owned-m6-real-fault",
      "success": true
    }
  ],
  "cleanup_failures": 0,
  "consistency_preconditions": [
    {
      "name": "dedicated-compose-project",
      "observed_at": "2026-07-29T20:02:17Z",
      "satisfied": true
    },
    {
      "name": "pinned-stack-ready",
      "observed_at": "2026-07-29T20:02:17Z",
      "satisfied": true
    },
    {
      "name": "baseline-lag-zero",
      "observed_at": "2026-07-29T20:02:17Z",
      "satisfied": true
    }
  ],
  "dependency_versions": {
    "canal": "1.1.8",
    "elasticsearch": "8.17.0",
    "kafka": "4.1.2",
    "mysql": "8.4.8",
    "project_head": "fb1a87733f0dcea5f41d1a0adbd1da2c980cac97"
  },
  "exact_diff_count": 0,
  "expected_intermediate_states": [
    "DEGRADED"
  ],
  "expected_pipeline_state": "HEALTHY",
  "failed_assertions": [],
  "finished_at": "2026-07-29T20:02:33Z",
  "observed_intermediate_states": [
    "DEGRADED"
  ],
  "observed_pipeline_state": "HEALTHY",
  "product_unresolved_dlq_count": 0,
  "rebuild_required_before_rebuild": false,
  "record_unresolved_dlq_count": 0,
  "recovery_action": "run M4 independent detection and bounded repair",
  "recovery_action_observed": true,
  "requires_rebuild": false,
  "result": "PASS",
  "runner_run_id": "b9c6a0fa-a626-4fe2-8e61-ebdb715deed1",
  "scenario_id": "manual-elasticsearch-drift",
  "scenario_lag_satisfied": true,
  "schema_version": 1,
  "source_watermark": 1,
  "started_at": "2026-07-29T20:01:26Z",
  "target_watermark_passed": true,
  "target_watermarks": {
    "elasticsearch_revision": 1,
    "mysql_revision": 1,
    "passed": true
  },
  "tombstone_mismatch_count": 0,
  "unresolved_dlq_count": 0,
  "verification": {
    "conclusive": true,
    "exact_managed_field_diff_count": 0,
    "observed_at": "2026-07-29T20:02:27Z",
    "run_id": "bf101ddb-d951-40cb-a063-d346568e192e",
    "stable": true,
    "status": "PASS",
    "version_metadata_diff_count": 0
  },
  "watermark_run_id": "bf101ddb-d951-40cb-a063-d346568e192e"
}
