{
  "applied_offsets": {
    "0": 1,
    "1": 0,
    "2": 4
  },
  "canal_position_recovery": null,
  "cleanup_actions": [
    {
      "finished_at": "2026-07-30T03:55:50Z",
      "name": "dispatch-owned-m6-real-fault",
      "success": true
    }
  ],
  "cleanup_failures": 0,
  "consistency_preconditions": [
    {
      "name": "dedicated-compose-project",
      "observed_at": "2026-07-30T03:55:23Z",
      "satisfied": true
    },
    {
      "name": "pinned-stack-ready",
      "observed_at": "2026-07-30T03:55:23Z",
      "satisfied": true
    },
    {
      "name": "baseline-lag-zero",
      "observed_at": "2026-07-30T03:55:23Z",
      "satisfied": true
    }
  ],
  "dependency_versions": {
    "canal": "1.1.8",
    "elasticsearch": "8.17.0",
    "kafka": "4.1.2",
    "mysql": "8.4.8",
    "project_head": "bb75ab0c19b3f64090faec9d281d56ff43087a55"
  },
  "exact_diff_count": 0,
  "expected_intermediate_states": [
    "HEALTHY"
  ],
  "expected_pipeline_state": "HEALTHY",
  "failed_assertions": [],
  "finished_at": "2026-07-30T03:56:02Z",
  "observed_intermediate_states": [
    "HEALTHY"
  ],
  "observed_pipeline_state": "HEALTHY",
  "product_unresolved_dlq_count": 0,
  "rebuild_required_before_rebuild": false,
  "record_unresolved_dlq_count": 0,
  "recovery_action": "rehydrate current MySQL state and apply the external-version fence",
  "recovery_action_observed": true,
  "requires_rebuild": false,
  "result": "PASS",
  "runner_run_id": "6667132c-78f4-48a3-93be-0f6890f5a8ef",
  "scenario_id": "late-old-revision",
  "scenario_lag_satisfied": true,
  "schema_version": 1,
  "source_watermark": 3,
  "started_at": "2026-07-30T03:54:21Z",
  "target_watermark_passed": true,
  "target_watermarks": {
    "elasticsearch_revision": 3,
    "mysql_revision": 3,
    "passed": true
  },
  "tombstone_mismatch_count": 0,
  "unresolved_dlq_count": 0,
  "verification": {
    "conclusive": true,
    "exact_managed_field_diff_count": 0,
    "observed_at": "2026-07-30T03:55:55Z",
    "run_id": "7a34117e-4fc5-489e-adfb-18607addddcf",
    "stable": true,
    "status": "PASS",
    "version_metadata_diff_count": 0
  },
  "watermark_run_id": "7a34117e-4fc5-489e-adfb-18607addddcf"
}
