{
  "applied_offsets": {
    "0": 15,
    "1": 14,
    "2": 13
  },
  "canal_position_recovery": null,
  "cleanup_actions": [
    {
      "finished_at": "2026-07-30T04:07:57Z",
      "name": "dispatch-owned-m6-real-fault",
      "success": true
    }
  ],
  "cleanup_failures": 0,
  "consistency_preconditions": [
    {
      "name": "dedicated-compose-project",
      "observed_at": "2026-07-30T04:06:07Z",
      "satisfied": true
    },
    {
      "name": "pinned-stack-ready",
      "observed_at": "2026-07-30T04:06:07Z",
      "satisfied": true
    },
    {
      "name": "baseline-lag-zero",
      "observed_at": "2026-07-30T04:06:07Z",
      "satisfied": true
    }
  ],
  "dependency_versions": {
    "canal": "1.1.8",
    "elasticsearch": "8.17.0",
    "kafka": "4.1.2",
    "mysql": "8.4.8",
    "project_head": "bb75ab0c19b3f64090faec9d281d56ff43087a55"
  },
  "exact_diff_count": 0,
  "expected_intermediate_states": [
    "REBUILDING"
  ],
  "expected_pipeline_state": "HEALTHY",
  "failed_assertions": [],
  "finished_at": "2026-07-30T04:08:15Z",
  "observed_intermediate_states": [
    "REBUILDING"
  ],
  "observed_pipeline_state": "HEALTHY",
  "product_unresolved_dlq_count": 0,
  "rebuild_required_before_rebuild": true,
  "record_unresolved_dlq_count": 0,
  "recovery_action": "complete the M5 shadow barrier gated atomic-alias cutover",
  "recovery_action_observed": true,
  "requires_rebuild": true,
  "result": "PASS",
  "runner_run_id": "9b004fba-f1b8-401c-9caf-e9c4dc3f9688",
  "scenario_id": "rebuild-with-concurrent-writes",
  "scenario_lag_satisfied": true,
  "schema_version": 1,
  "source_watermark": 4,
  "started_at": "2026-07-30T04:04:53Z",
  "target_watermark_passed": true,
  "target_watermarks": {
    "elasticsearch_revision": 4,
    "mysql_revision": 4,
    "passed": true
  },
  "tombstone_mismatch_count": 0,
  "unresolved_dlq_count": 0,
  "verification": {
    "conclusive": true,
    "exact_managed_field_diff_count": 0,
    "observed_at": "2026-07-30T04:08:04Z",
    "run_id": "ba41c22c-4740-4dbf-b146-cb107051098f",
    "stable": true,
    "status": "PASS",
    "version_metadata_diff_count": 0
  },
  "watermark_run_id": "ba41c22c-4740-4dbf-b146-cb107051098f"
}
